{
  "homepage": "https://libusb.info/",
  "maintainers": [
    {
      "email": "daisuke.nishimatsu1021@gmail.com",
      "github": "wep21",
      "name": "Daisuke Nishimatsu",
      "github_user_id": 42202095
    }
  ],
  "repository": [
    "github:libusb/libusb"
  ],
  "versions": [
    "1.0.29"
  ],
  "yanked_versions": {}
}