{
  "homepage": "http://boost.org/libs/redis",
  "maintainers": [
    {
      "email": "caesar@kekxv.com",
      "github": "kekxv",
      "name": "kekxv",
      "github_user_id": 15551108
    }
  ],
  "repository": [
    "github:boostorg/redis"
  ],
  "versions": [
    "1.90.0.bcr.1"
  ],
  "yanked_versions": {}
}
