{
  "homepage": "https://github.com/quickjs-ng/quickjs/",
  "maintainers": [
    {
      "email": "caesar@kekxv.com",
      "github": "kekxv",
      "name": "kekxv",
      "github_user_id": 15551108
    }
  ],
  "repository": [
    "https://github.com/quickjs-ng/quickjs/"
  ],
  "versions": [
    "0.11.0",
    "0.11.0.bcr.1",
    "0.13.0",
    "0.14.0",
    "0.15.0",
    "0.15.1"
  ],
  "yanked_versions": {}
}
