{
  "homepage": "https://github.com/ClangTools/khttpd",
  "maintainers": [
    {
      "email": "caesar@kekxv.com",
      "github": "kekxv",
      "name": "kekxv"
    }
  ],
  "repository": [
    "github:ClangTools/khttpd"
  ],
  "versions": [
    "0.1.0",
    "0.3.0",
    "0.4.0",
    "0.4.1",
    "0.4.2",
    "0.4.3",
    "0.4.4",
    "0.4.5",
    "0.4.6",
    "0.5.0",
    "0.5.1",
    "0.5.2",
    "0.5.3"
  ],
  "yanked_versions": {}
}
