{
  "homepage": "https://github.com/uriparser/uriparser",
  "maintainers": [
    {
      "email": "caesar@kekxv.com",
      "github": "kekxv",
      "name": "kekxv",
      "github_user_id": 15551108
    }
  ],
  "repository": [
    "github:uriparser/uriparser"
  ],
  "versions": [
    "1.0.2",
    "1.0.2.bcr.1"
  ],
  "yanked_versions": {}
}
